{
  "version": 2,
  "generatedAt": "2026-06-29",
  "description": "Phase 2 曲库 seed v2：编制 (arrangement)、分声部难度 (parts)、缺人方案 (fallbacks)。AI 写推荐语，规则引擎筛候选。",
  "songs": [
    {
      "id": "song-001",
      "title": "平凡之路",
      "artist": "朴树",
      "style": "folk",
      "styles": [
        "rock"
      ],
      "bpm": 72,
      "notes": "四和弦为主，适合新手乐队第一首完整曲目",
      "arrangement": {
        "vocals": "required",
        "guitars": {
          "count": 1,
          "lead": "none",
          "rhythm": "required"
        },
        "bass": "optional",
        "drums": "program_ok",
        "keyboard": "none"
      },
      "parts": {
        "vocals": {
          "minLevel": 2
        },
        "rhythmGuitar": {
          "minLevel": 2
        },
        "bass": {
          "minLevel": 2
        },
        "drums": {
          "minLevel": 2
        }
      },
      "fallbacks": {
        "missingLeadGuitar": "not_applicable",
        "missingRhythmGuitar": "program_rhythm",
        "missingBass": "omit",
        "missingDrums": "program_drums",
        "missingKeyboard": "not_applicable",
        "missingVocals": "not_applicable"
      }
    },
    {
      "id": "song-002",
      "title": "活着",
      "artist": "郝云",
      "style": "folk",
      "styles": [
        "rock"
      ],
      "bpm": 118,
      "notes": "扫弦节奏明快，鼓点规律",
      "arrangement": {
        "vocals": "required",
        "guitars": {
          "count": 1,
          "lead": "none",
          "rhythm": "required"
        },
        "bass": "optional",
        "drums": "program_ok",
        "keyboard": "none"
      },
      "parts": {
        "vocals": {
          "minLevel": 2
        },
        "rhythmGuitar": {
          "minLevel": 2
        },
        "bass": {
          "minLevel": 2
        },
        "drums": {
          "minLevel": 2
        }
      },
      "fallbacks": {
        "missingLeadGuitar": "not_applicable",
        "missingRhythmGuitar": "program_rhythm",
        "missingBass": "omit",
        "missingDrums": "program_drums",
        "missingKeyboard": "not_applicable",
        "missingVocals": "not_applicable"
      }
    },
    {
      "id": "song-003",
      "title": "成都",
      "artist": "赵雷",
      "style": "folk",
      "bpm": 88,
      "notes": "木吉他编制也成立，可弱化鼓贝斯",
      "arrangement": {
        "vocals": "required",
        "guitars": {
          "count": 1,
          "lead": "none",
          "rhythm": "required"
        },
        "bass": "none",
        "drums": "optional",
        "keyboard": "none"
      },
      "parts": {
        "vocals": {
          "minLevel": 2
        },
        "rhythmGuitar": {
          "minLevel": 2
        },
        "drums": {
          "minLevel": 2
        }
      },
      "fallbacks": {
        "missingLeadGuitar": "not_applicable",
        "missingRhythmGuitar": "program_rhythm",
        "missingBass": "omit",
        "missingDrums": "omit",
        "missingKeyboard": "not_applicable",
        "missingVocals": "not_applicable"
      }
    },
    {
      "id": "song-004",
      "title": "南方姑娘",
      "artist": "赵雷",
      "style": "folk",
      "bpm": 76,
      "notes": "分解和弦为主，主唱音域适中",
      "arrangement": {
        "vocals": "required",
        "guitars": {
          "count": 1,
          "lead": "none",
          "rhythm": "required"
        },
        "bass": "optional",
        "drums": "program_ok",
        "keyboard": "none"
      },
      "parts": {
        "vocals": {
          "minLevel": 2
        },
        "rhythmGuitar": {
          "minLevel": 2
        },
        "bass": {
          "minLevel": 2
        },
        "drums": {
          "minLevel": 2
        }
      },
      "fallbacks": {
        "missingLeadGuitar": "not_applicable",
        "missingRhythmGuitar": "program_rhythm",
        "missingBass": "omit",
        "missingDrums": "program_drums",
        "missingKeyboard": "not_applicable",
        "missingVocals": "not_applicable"
      }
    },
    {
      "id": "song-005",
      "title": "董小姐",
      "artist": "宋冬野",
      "style": "folk",
      "bpm": 68,
      "notes": "可只用吉他+主唱排练，鼓可后加",
      "arrangement": {
        "vocals": "required",
        "guitars": {
          "count": 1,
          "lead": "none",
          "rhythm": "required"
        },
        "bass": "none",
        "drums": "optional",
        "keyboard": "none"
      },
      "parts": {
        "vocals": {
          "minLevel": 2
        },
        "rhythmGuitar": {
          "minLevel": 2
        },
        "drums": {
          "minLevel": 1
        }
      },
      "fallbacks": {
        "missingLeadGuitar": "not_applicable",
        "missingRhythmGuitar": "program_rhythm",
        "missingBass": "omit",
        "missingDrums": "omit",
        "missingKeyboard": "not_applicable",
        "missingVocals": "not_applicable"
      }
    },
    {
      "id": "song-006",
      "title": "南山南",
      "artist": "马頔",
      "style": "folk",
      "bpm": 62,
      "notes": "慢歌，注意主唱气息与吉他分解均匀",
      "arrangement": {
        "vocals": "required",
        "guitars": {
          "count": 1,
          "lead": "none",
          "rhythm": "required"
        },
        "bass": "optional",
        "drums": "program_ok",
        "keyboard": "none"
      },
      "parts": {
        "vocals": {
          "minLevel": 2
        },
        "rhythmGuitar": {
          "minLevel": 2
        },
        "bass": {
          "minLevel": 2
        },
        "drums": {
          "minLevel": 2
        }
      },
      "fallbacks": {
        "missingLeadGuitar": "not_applicable",
        "missingRhythmGuitar": "program_rhythm",
        "missingBass": "omit",
        "missingDrums": "program_drums",
        "missingKeyboard": "not_applicable",
        "missingVocals": "not_applicable"
      }
    },
    {
      "id": "song-007",
      "title": "稻香",
      "artist": "周杰伦",
      "style": "pop",
      "styles": [
        "folk"
      ],
      "bpm": 82,
      "notes": "流行入门经典，键盘铺底加分",
      "arrangement": {
        "vocals": "required",
        "guitars": {
          "count": 1,
          "lead": "none",
          "rhythm": "required"
        },
        "bass": "optional",
        "drums": "program_ok",
        "keyboard": "optional_pad"
      },
      "parts": {
        "vocals": {
          "minLevel": 2
        },
        "rhythmGuitar": {
          "minLevel": 2
        },
        "bass": {
          "minLevel": 2
        },
        "drums": {
          "minLevel": 2
        },
        "keyboard": {
          "minLevel": 2
        }
      },
      "fallbacks": {
        "missingLeadGuitar": "not_applicable",
        "missingRhythmGuitar": "program_rhythm",
        "missingBass": "omit",
        "missingDrums": "program_drums",
        "missingKeyboard": "omit",
        "missingVocals": "not_applicable"
      }
    },
    {
      "id": "song-008",
      "title": "小幸运",
      "artist": "田馥甄",
      "style": "pop",
      "bpm": 72,
      "notes": "女声明亮版或降调男声均可",
      "arrangement": {
        "vocals": "required",
        "guitars": {
          "count": 1,
          "lead": "none",
          "rhythm": "required"
        },
        "bass": "optional",
        "drums": "program_ok",
        "keyboard": "optional_pad"
      },
      "parts": {
        "vocals": {
          "minLevel": 2
        },
        "rhythmGuitar": {
          "minLevel": 2
        },
        "bass": {
          "minLevel": 2
        },
        "drums": {
          "minLevel": 2
        },
        "keyboard": {
          "minLevel": 2
        }
      },
      "fallbacks": {
        "missingLeadGuitar": "not_applicable",
        "missingRhythmGuitar": "program_rhythm",
        "missingBass": "omit",
        "missingDrums": "program_drums",
        "missingKeyboard": "omit",
        "missingVocals": "not_applicable"
      }
    },
    {
      "id": "song-009",
      "title": "后来",
      "artist": "刘若英",
      "style": "pop",
      "bpm": 76,
      "notes": "校园乐队常练，结构简单",
      "arrangement": {
        "vocals": "required",
        "guitars": {
          "count": 1,
          "lead": "none",
          "rhythm": "required"
        },
        "bass": "optional",
        "drums": "program_ok",
        "keyboard": "optional_pad"
      },
      "parts": {
        "vocals": {
          "minLevel": 2
        },
        "rhythmGuitar": {
          "minLevel": 2
        },
        "bass": {
          "minLevel": 2
        },
        "drums": {
          "minLevel": 2
        },
        "keyboard": {
          "minLevel": 2
        }
      },
      "fallbacks": {
        "missingLeadGuitar": "not_applicable",
        "missingRhythmGuitar": "program_rhythm",
        "missingBass": "omit",
        "missingDrums": "program_drums",
        "missingKeyboard": "omit",
        "missingVocals": "not_applicable"
      }
    },
    {
      "id": "song-010",
      "title": "晴天",
      "artist": "周杰伦",
      "style": "pop",
      "bpm": 69,
      "notes": "吉他扫弦+切分，比入门曲稍难",
      "arrangement": {
        "vocals": "required",
        "guitars": {
          "count": 1,
          "lead": "optional",
          "rhythm": "required"
        },
        "bass": "optional",
        "drums": "program_ok",
        "keyboard": "important"
      },
      "parts": {
        "vocals": {
          "minLevel": 3
        },
        "rhythmGuitar": {
          "minLevel": 3
        },
        "leadGuitar": {
          "minLevel": 3
        },
        "bass": {
          "minLevel": 2
        },
        "drums": {
          "minLevel": 2
        },
        "keyboard": {
          "minLevel": 3
        }
      },
      "fallbacks": {
        "missingLeadGuitar": "combine_into_rhythm",
        "missingRhythmGuitar": "program_rhythm",
        "missingBass": "omit",
        "missingDrums": "program_drums",
        "missingKeyboard": "program_pad",
        "missingVocals": "not_applicable"
      }
    },
    {
      "id": "song-011",
      "title": "夜空中最亮的星",
      "artist": "逃跑计划",
      "style": "indie",